{"schema_version":"1.0.0-fixture","fixture":true,"operational":false,"status":"PROPOSED","summary":"Events V2 will preserve V1 IDs, curated fields and compatibility outputs while rebuilding the data backend under Enigma Core.","current_phase":"E1 current-system audit","architecture_completion_percent":10,"implementation_completion_percent":0,"open_blocker_count":0,"tasks":[{"title":"Current production Events V1","status":"ACTIVE","detail":"V1 remains the only production events system."},{"title":"E1 current-system audit","status":"NOT_STARTED","detail":"Inventory existing sources, fields, identity and update behavior."},{"title":"E2 canonical contracts","status":"PLANNED","detail":"Event, occurrence, venue, organizer and offer contracts."},{"title":"E3 source registry","status":"PLANNED","detail":"Originating, corroboration, discovery and manual lanes."},{"title":"V2 implementation","status":"NOT_AUTHORIZED","detail":"No adapters, acquisition or production feed changes authorized."}]}